[
  {
    "retention_permanent_archive_terminal_closure_rollup_report_closeout_record_id": "retention-permanent-archive-terminal-closure-rollup-report-closeout-basic-restore-001",
    "closeout_kind": "retention_permanent_archive_terminal_closure_rollup_report_closeout",
    "created_time": "2026-01-01T00:14:48Z",
    "node_id": "formal-rollup-node-example",
    "retention_permanent_archive_terminal_closure_rollup_report_verification_receipt_id": "retention-permanent-archive-terminal-closure-rollup-report-verification-basic-restore-001",
    "retention_permanent_archive_terminal_closure_rollup_report_record_id": "retention-permanent-archive-terminal-closure-rollup-report-basic-restore-001",
    "closeout_state": "closed",
    "outcome": "retention_permanent_archive_terminal_closure_rollup_report_verified_and_closed",
    "closed_refs": [
      "retention-permanent-archive-terminal-closure-rollup-report-verification-basic-restore-001",
      "retention-permanent-archive-terminal-closure-rollup-report-basic-restore-001",
      "retention/retention-policy.json"
    ],
    "subject_refs": [
      "retention-permanent-archive-terminal-closure-record-verification-basic-restore-001",
      "retention-permanent-archive-terminal-closure-record-basic-restore-001",
      "retention-permanent-archive-terminal-final-distribution-summary-closeout-basic-restore-001"
    ],
    "basis_refs": [
      "retention-permanent-archive-terminal-closure-rollup-report-verification-basic-restore-001",
      "retention-permanent-archive-terminal-closure-rollup-report-basic-restore-001",
      "retention/retention-policy.json"
    ],
    "closed_by_ref": "tools/pfem_retention_permanent_archive_terminal_closure_rollup_report_closeout_records.py",
    "summary": "Synthetic example retention permanent archive terminal closure rollup report closeout record showing workflow was closed after verification."
  }
]
